
NEEDS FILTER STILL
 
00:38:52.930327 ARP, Request who-has 192.1.3.254 tell 192.1.3.33, length 28
00:38:52.930496 ARP, Reply 192.1.3.254 is-at 12:00:00:32:64:ba, length 28
00:38:52.930564 IP 192.1.3.33.isakmp > 192.1.2.23.isakmp: isakmp: phase 2/others ? inf[E]
00:38:52.932615 IP 192.1.2.23.isakmp > 192.1.3.33.isakmp: isakmp: phase 2/others ? inf[E]
00:38:52.938882 IP 192.1.3.33.isakmp > 192.1.2.23.isakmp: isakmp: phase 2/others ? inf[E]
00:38:52.976995 IP 192.1.2.23.isakmp > 192.1.3.33.isakmp: isakmp: phase 2/others ? inf[E]
00:38:53.652509 IP6 fe80::1000:ff:fe96:9649 > ff02::16: HBH ICMP6, multicast listener report v2, 2 group record(s), length 48
00:38:57.950583 ARP, Request who-has 192.1.3.33 tell 192.1.3.254, length 28
00:38:58.952601 ARP, Request who-has 192.1.3.33 tell 192.1.3.254, length 28
00:38:59.954593 ARP, Request who-has 192.1.3.33 tell 192.1.3.254, length 28
00:39:07.250246 IP6 fe80::1000:ff:fe96:9649 > ff02::16: HBH ICMP6, multicast listener report v2, 3 group record(s), length 68
00:39:07.253438 ARP, Request who-has 192.1.3.33 (Broadcast) tell 0.0.0.0, length 28
00:39:08.253575 ARP, Request who-has 192.1.3.33 (Broadcast) tell 0.0.0.0, length 28
00:39:09.257757 ARP, Reply 192.1.3.33 is-at 12:00:00:96:96:49, length 28
00:39:11.265525 ARP, Request who-has 192.1.3.33 (Broadcast) tell 192.1.3.33, length 28
00:39:15.055441 IP6 fe80::1000:ff:fe96:9649 > ff02::16: HBH ICMP6, multicast listener report v2, 3 group record(s), length 68
00:39:36.789681 ARP, Request who-has 192.1.3.254 tell 192.1.3.33, length 28
00:39:36.789806 ARP, Reply 192.1.3.254 is-at 12:00:00:32:64:ba, length 28
00:39:36.789849 IP 192.1.3.33.isakmp > 192.1.2.23.isakmp: isakmp: phase 1 I ident
00:39:36.794515 IP 192.1.2.23.isakmp > 192.1.3.33.isakmp: isakmp: phase 1 R ident
00:39:36.798822 IP 192.1.3.33.isakmp > 192.1.2.23.isakmp: isakmp: phase 1 I ident
00:39:36.803511 IP 192.1.2.23.isakmp > 192.1.3.33.isakmp: isakmp: phase 1 R ident
00:39:36.818537 IP 192.1.3.33.isakmp > 192.1.2.23.isakmp: isakmp: phase 1 I ident[E]
00:39:36.829244 IP 192.1.2.23.isakmp > 192.1.3.33.isakmp: isakmp: phase 1 R ident[E]
00:39:36.842398 IP 192.1.3.33.isakmp > 192.1.2.23.isakmp: isakmp: phase 2/others I oakley-quick[E]
00:39:36.855463 IP 192.1.2.23.isakmp > 192.1.3.33.isakmp: isakmp: phase 2/others R oakley-quick[E]
00:39:36.912567 IP 192.1.3.33.isakmp > 192.1.2.23.isakmp: isakmp: phase 2/others I oakley-quick[E]
00:39:37.525542 IP 192.1.3.33 > 192.1.2.23: ESP(spi=0x22310644,seq=0x1), length 132
00:39:37.526227 IP 192.1.2.23 > 192.1.3.33: ESP(spi=0xabac562e,seq=0x1), length 132
00:39:38.527684 IP 192.1.3.33 > 192.1.2.23: ESP(spi=0x22310644,seq=0x2), length 132
00:39:38.528446 IP 192.1.2.23 > 192.1.3.33: ESP(spi=0xabac562e,seq=0x2), length 132
00:39:39.529225 IP 192.1.3.33 > 192.1.2.23: ESP(spi=0x22310644,seq=0x3), length 132
00:39:39.530075 IP 192.1.2.23 > 192.1.3.33: ESP(spi=0xabac562e,seq=0x3), length 132
00:39:40.531289 IP 192.1.3.33 > 192.1.2.23: ESP(spi=0x22310644,seq=0x4), length 132
00:39:40.532155 IP 192.1.2.23 > 192.1.3.33: ESP(spi=0xabac562e,seq=0x4), length 132
00:39:41.806632 ARP, Request who-has 192.1.3.33 tell 192.1.3.254, length 28
00:39:41.806805 ARP, Reply 192.1.3.33 is-at 12:00:00:96:96:49, length 28
