17:25:34.771717 ARP, Request who-has 192.1.3.33 tell 192.1.3.254, length 28
17:25:34.771819 ARP, Reply 192.1.3.33 is-at 12:00:00:96:96:49, length 28
17:25:34.772252 IP 192.1.2.23.isakmp > 192.1.3.33.isakmp: isakmp: phase 2/others ? inf[E]
17:25:34.787822 IP 192.1.3.33.isakmp > 192.1.2.23.isakmp: isakmp: phase 2/others ? inf[E]
17:25:34.819537 IP 192.1.2.23.isakmp > 192.1.3.33.isakmp: isakmp: phase 2/others ? inf[E]
17:25:34.877849 IP 192.1.3.33.isakmp > 192.1.2.23.isakmp: isakmp: phase 2/others ? inf[E]
17:25:35.585660 IP6 fe80::1000:ff:fe96:9649 > ff02::16: HBH ICMP6, multicast listener report v2, 2 group record(s), length 48
17:25:49.608386 IP6 fe80::1000:ff:fe96:9649 > ff02::16: HBH ICMP6, multicast listener report v2, 3 group record(s), length 68
17:25:49.611300 ARP, Request who-has 192.1.3.33 (Broadcast) tell 0.0.0.0, length 28
17:25:50.611616 ARP, Request who-has 192.1.3.33 (Broadcast) tell 0.0.0.0, length 28
17:25:51.615812 ARP, Reply 192.1.3.33 is-at 12:00:00:96:96:49, length 28
17:25:52.505392 IP6 fe80::1000:ff:fe96:9649 > ff02::16: HBH ICMP6, multicast listener report v2, 3 group record(s), length 68
17:25:53.623198 ARP, Request who-has 192.1.3.33 (Broadcast) tell 192.1.3.33, length 28
17:26:17.014258 ARP, Request who-has 192.1.3.254 tell 192.1.3.33, length 28
17:26:17.014409 ARP, Reply 192.1.3.254 is-at 12:00:00:32:64:ba, length 28
17:26:17.014464 IP 192.1.3.33.isakmp > 192.1.2.23.isakmp: isakmp: phase 1 I ident
17:26:17.020737 IP 192.1.2.23.isakmp > 192.1.3.33.isakmp: isakmp: phase 1 R ident
17:26:17.025866 IP 192.1.3.33.isakmp > 192.1.2.23.isakmp: isakmp: phase 1 I ident
17:26:17.037386 IP 192.1.2.23.isakmp > 192.1.3.33.isakmp: isakmp: phase 1 R ident
17:26:17.056644 IP 192.1.3.33.isakmp > 192.1.2.23.isakmp: isakmp: phase 1 I ident[E]
17:26:17.066738 IP 192.1.2.23.isakmp > 192.1.3.33.isakmp: isakmp: phase 1 R ident[E]
17:26:17.078215 IP 192.1.3.33.isakmp > 192.1.2.23.isakmp: isakmp: phase 2/others I oakley-quick[E]
17:26:17.086084 IP 192.1.2.23.isakmp > 192.1.3.33.isakmp: isakmp: phase 2/others R oakley-quick[E]
17:26:17.145549 IP 192.1.3.33.isakmp > 192.1.2.23.isakmp: isakmp: phase 2/others I oakley-quick[E]
17:26:17.761834 IP 192.1.3.33 > 192.1.2.23: ESP(spi=0x1a6075c9,seq=0x1), length 132
17:26:17.762408 IP 192.1.2.23 > 192.1.3.33: ESP(spi=0x292a1263,seq=0x1), length 132
17:26:18.763513 IP 192.1.3.33 > 192.1.2.23: ESP(spi=0x1a6075c9,seq=0x2), length 132
17:26:18.764454 IP 192.1.2.23 > 192.1.3.33: ESP(spi=0x292a1263,seq=0x2), length 132
17:26:19.765207 IP 192.1.3.33 > 192.1.2.23: ESP(spi=0x1a6075c9,seq=0x3), length 132
17:26:19.765954 IP 192.1.2.23 > 192.1.3.33: ESP(spi=0x292a1263,seq=0x3), length 132
17:26:20.767239 IP 192.1.3.33 > 192.1.2.23: ESP(spi=0x1a6075c9,seq=0x4), length 132
17:26:20.768189 IP 192.1.2.23 > 192.1.3.33: ESP(spi=0x292a1263,seq=0x4), length 132
17:26:22.030799 ARP, Request who-has 192.1.3.33 tell 192.1.3.254, length 28
17:26:22.030963 ARP, Reply 192.1.3.33 is-at 12:00:00:96:96:49, length 28
